{
  "catalogVersion": "2026-10-05.0396bc77",
  "date": "2026-10-08",
  "kind": "anime-quiz-bonus",
  "mal": true,
  "rounds": [
    {
      "a": "fixture:tr:tr06",
      "answer": "a",
      "b": "fixture:tr:tr36",
      "direction": "max",
      "family": "ano",
      "info": {
        "seasons": [
          {
            "season": "spring",
            "year": 2025
          },
          {
            "season": "spring",
            "year": 2024
          }
        ]
      }
    },
    {
      "a": "fixture:tr:tr07",
      "answer": "a",
      "b": "fixture:tr:tr09",
      "direction": "nao",
      "family": "tema",
      "info": {
        "themes": [
          "ED",
          "OP1"
        ]
      }
    },
    {
      "a": "fixture:tr:tr09",
      "answer": "b",
      "b": "fixture:tr:tr36",
      "direction": "max",
      "family": "nota",
      "info": {
        "diff": 0.62
      }
    }
  ],
  "schemaVersion": 1
}
